{
  "schema_version": "1.0",
  "project": {
    "name": "m4_ekf_observer",
    "paths": {
      "io_dir": "include",
      "core_dir": "src/RX32G410_FW_HAL_V1.3N/Projects/core",
      "app_dir": "app",
      "base_class_dir": "base_class",
      "proto_dir": "proto"
    },
    "std_module_path": "src/RX32G410_FW_HAL_V1.3N/Projects/core/std_module.h",
    "pack": 4,
    "comment_guard": true,
    "output_root": "../m4_ekf_observer"
  },
  "modules": [
    {
      "id": "appadc",
      "name": "AppAdc",
      "layer": "app",
      "source_file": "app/adc_sensor.c",
      "comment": "ADC 采样 — 输出谐振电流/电压/HRTIM 时序到 Calculator 和功率参数到 AppPower"
    },
    {
      "id": "apppower",
      "name": "AppPower",
      "layer": "app",
      "source_file": "src/RX32G410_FW_HAL_V1.3N/Projects/LIB/APP/APP_POWER.C",
      "comment": "功率控制 PID — 从 AppAdc 拉取数据，输出功率增量到 DrvHrtim"
    },
    {
      "id": "calculator",
      "name": "Calculator",
      "layer": "base_class",
      "source_file": "src/RX32G410_FW_HAL_V1.3N/Projects/BaseClass/src/calculator.c",
      "comment": "功率计算器 — 从 ADC 原始数据计算谐振电流/相位角/电压"
    },
    {
      "id": "elecparams",
      "name": "ElecParams",
      "layer": "base_class",
      "source_file": "src/RX32G410_FW_HAL_V1.3N/Projects/BaseClass/src/elec_params.c",
      "comment": "电参数计算 — 20ms 周期计算 I_peak/L/f_res/Q/R/P 等，输出到 AppPower 和 EKF_LKF"
    },
    {
      "id": "drvhrtim",
      "name": "DrvHrtim",
      "layer": "base_class",
      "source_file": "base_class/drv_hrtim_consumer.c",
      "comment": "HRTIM 驱动 — 功率命令下发到硬件，反馈硬件状态"
    },
    {
      "id": "ekf_lkf",
      "name": "EKF_LKF",
      "layer": "base_class",
      "source_file": "src/RX32G410_FW_HAL_V1.3N/Projects/BaseClass/src/ekf_lkf.c",
      "comment": "扩展卡尔曼滤波观测器 — 从 ElecParams 读取观测值，估计 [R, L, f_res]"
    }
  ],
  "pipes": [
    {
      "id": "pipe_appadc_apppower",
      "from": "AppAdc",
      "to": "AppPower",
      "callback_type": "pull",
      "comment": "ADC → Power: 电压/电流/相位等功率控制参数",
      "out_link": {
        "style": "pointer",
        "array_size": 4
      },
      "in_link": {
        "style": "pointer"
      },
      "fields": [
        {
          "name": "voltage",
          "type": "uint16_t",
          "comment": "母线电压 ADC"
        },
        {
          "name": "power",
          "type": "uint16_t[4]",
          "comment": "每炉头功率 ADC"
        },
        {
          "name": "txa",
          "type": "uint16_t[4]",
          "comment": "每炉头谐振电流 ADC"
        },
        {
          "name": "phase",
          "type": "uint16_t[4]",
          "comment": "每炉头相位 ADC"
        }
      ]
    },
    {
      "id": "pipe_appadc_calculator",
      "from": "AppAdc",
      "to": "Calculator",
      "callback_type": "pull",
      "comment": "ADC → Calculator: 谐振电流/HRTIM 时序原始数据",
      "out_link": {
        "style": "pointer"
      },
      "in_link": {
        "style": "pointer"
      },
      "fields": [
        {
          "name": "resonant_current",
          "type": "uint16_t**",
          "comment": "谐振电流 ADC 数组指针数组"
        },
        {
          "name": "hrtim_values",
          "type": "uint16_t**",
          "comment": "HRTIM 时间戳数组指针数组"
        },
        {
          "name": "voltage_data",
          "type": "uint16_t**",
          "comment": "母线电压数组指针数组"
        }
      ]
    },
    {
      "id": "pipe_calculator_elecparams",
      "from": "Calculator",
      "to": "ElecParams",
      "callback_type": "pull",
      "comment": "Calculator → ElecParams: 电流积分/电压/过零点等中间结果",
      "out_link": {
        "style": "array",
        "array_size": 80
      },
      "in_link": {
        "style": "pointer"
      },
      "fields": [
        {
          "name": "hrtim",
          "type": "struct",
          "comment": "HRTIM 时序参数",
          "fields": [
            {
              "name": "highOff",
              "type": "uint16_t",
              "comment": "上管关断 HRTIM 值"
            },
            {
              "name": "lowOff",
              "type": "uint16_t",
              "comment": "下管关断 HRTIM 值"
            },
            {
              "name": "highOn",
              "type": "uint16_t",
              "comment": "上管开通 HRTIM 值"
            },
            {
              "name": "lowOn",
              "type": "uint16_t",
              "comment": "下管开通 HRTIM 值"
            }
          ]
        },
        {
          "name": "peak_current",
          "type": "uint16_t",
          "comment": "峰值电流 ADC"
        },
        {
          "name": "active_current_sum_high",
          "type": "uint32_t",
          "comment": "上管电流积分和"
        },
        {
          "name": "active_current_sum_low",
          "type": "uint32_t",
          "comment": "下管电流积分和"
        },
        {
          "name": "voltage_sum",
          "type": "uint32_t",
          "comment": "电压原始累加"
        },
        {
          "name": "voltage_count",
          "type": "uint16_t",
          "comment": "电压累加计数"
        },
        {
          "name": "zero_cross_high",
          "type": "uint16_t",
          "comment": "上管过零点"
        },
        {
          "name": "zero_cross_low",
          "type": "uint16_t",
          "comment": "下管过零点"
        },
        {
          "name": "peak_point",
          "type": "uint16_t",
          "comment": "峰值点 HRTIM 值"
        }
      ]
    },
    {
      "id": "pipe_calculator_apppower",
      "from": "Calculator",
      "to": "AppPower",
      "callback_type": "pull",
      "comment": "Calculator → AppPower: 20ms 周期累积平均值 (谐振电流/电压/相位角)",
      "out_link": {
        "style": "array",
        "array_size": 4
      },
      "in_link": {
        "style": "pointer"
      },
      "fields": [
        {
          "name": "resonant_current",
          "type": "int32_t",
          "comment": "谐振电流均值 (0.01A)"
        },
        {
          "name": "voltage",
          "type": "int32_t",
          "comment": "母线电压均值 (0.01V)"
        },
        {
          "name": "phase_angle",
          "type": "int32_t",
          "comment": "相位角 (0.01°)"
        },
        {
          "name": "valid",
          "type": "uint8_t",
          "comment": "数据有效性"
        }
      ]
    },
    {
      "id": "pipe_elecparams_ekf_lkf",
      "from": "ElecParams",
      "to": "EKF_LKF",
      "callback_type": "pull",
      "comment": "ElecParams → EKF: 电参数观测值 (共享 ElecParams→AppPower 输出 LINK)",
      "out_link": {
        "style": "array",
        "array_size": 4
      },
      "in_link": {
        "style": "pointer"
      },
      "fields": [
        {
          "name": "I_peak_A",
          "type": "int32_t",
          "comment": "峰值电流 (0.01A)"
        },
        {
          "name": "Vdc_mean",
          "type": "int32_t",
          "comment": "母线电压均值 (0.01V)"
        },
        {
          "name": "phi_deg",
          "type": "int32_t",
          "comment": "相位角 (0.01°)"
        },
        {
          "name": "L_uH",
          "type": "int32_t",
          "comment": "等效电感 (0.01μH)"
        },
        {
          "name": "f_res_kHz",
          "type": "int32_t",
          "comment": "谐振频率 (0.01kHz)"
        },
        {
          "name": "R_ohm",
          "type": "int32_t",
          "comment": "等效电阻 (0.01Ω)"
        },
        {
          "name": "f_sw_Hz",
          "type": "int32_t",
          "comment": "开关频率 (0.01Hz)"
        },
        {
          "name": "P_W",
          "type": "int32_t",
          "comment": "有功功率 (0.01W)"
        },
        {
          "name": "Q_factor",
          "type": "int32_t",
          "comment": "品质因数 (0.01)"
        },
        {
          "name": "valid",
          "type": "uint8_t",
          "comment": "数据有效性"
        }
      ]
    },
    {
      "id": "pipe_ekf_lkf_apppower",
      "from": "EKF_LKF",
      "to": "AppPower",
      "callback_type": "pull",
      "comment": "EKF → Power: 卡尔曼滤波后的负载参数 (R/L/f_res)",
      "out_link": {
        "style": "array",
        "array_size": 4
      },
      "in_link": {
        "style": "pointer"
      },
      "fields": [
        {
          "name": "R_ohm",
          "type": "int32_t",
          "comment": "等效电阻 (0.01Ω)"
        },
        {
          "name": "L_uH",
          "type": "int32_t",
          "comment": "等效电感 (0.01μH)"
        },
        {
          "name": "f_res_kHz",
          "type": "int32_t",
          "comment": "谐振频率 (0.01kHz)"
        },
        {
          "name": "Q_factor",
          "type": "int32_t",
          "comment": "品质因数 (0.01)"
        },
        {
          "name": "valid",
          "type": "uint8_t",
          "comment": "数据有效性"
        }
      ]
    }
  ],
  "slot_order": [
    "AppAdc",
    "AppPower",
    "Calculator",
    "ElecParams",
    "EKF_LKF"
  ],
  "slot_chains": [
    {
      "name": "Slot1",
      "comment": "1ms 实时控制: AppAdc → AppPower",
      "modules": [
        "AppAdc",
        "AppPower"
      ]
    },
    {
      "name": "TK",
      "comment": "20ms 周期: Calculator → ElecParams → EKF_LKF",
      "modules": [
        "Calculator",
        "ElecParams",
        "EKF_LKF"
      ]
    }
  ]
}